commit	val_bpb	memory_mb	status	description
7d32f27	2.403	9.4	keep	MPS device (Apple Silicon GPU): 2396-3134 steps vs ~1300 CPU, avg ~2.44 bpb over 3 runs
64c3234	2.292	5.5	keep	MPS+seq=160+lr=1.5e-2+betas=(0.75,0.95)+no-LN+SwiGLU-4x: avg 2.292 over 5 good runs
64c3234	2.765	5.5	discard	Same config under thermal throttle: avg 2.765 over 10 runs (system under load)
9984559	2.376	5.6	keep	SDPA+batch=64+seq=64+lr=1.5e-2+MPS+no-LN+SwiGLU-4x: avg 2.415 over 13 runs, min 2.376
0143ac1	2.324	5.6	keep	SDPA+batch=64+seq=64+lr=1.5e-2+init_std=0.08: avg 2.388 over 16 runs, min 2.324
36370d2	2.273	5.6	keep	SDPA+batch=64+seq=64+lr=1.5e-2+init_std=0.20: avg 2.305 over 16 runs, min 2.273
4c833bf	2.318	5.6	discard	warmup=140: mean 2.318 (8 runs) vs 2.305 baseline — worse
4a73088	2.443	5.6	discard	lr=2.5e-2 with init_std=0.20: mean 2.443 (8 runs) — much worse
ff7a2e0	2.377	5.6	discard	GeGLU activation: mean 2.377 (8 runs) vs 2.305 SwiGLU baseline
4609406	2.516	5.6	discard	0xd8b7e635 config n_embd=160+lr=3e-2+wd=0.1+clip=0.5: mean 2.516 (8 runs)
cbe13ff	2.377	5.6	discard	n_embd=160 fewer steps (mean 2.377 vs 2.305 baseline)
8e3f5ba	2.316	5.6	discard	total=1100 cosine: mean 2.316 vs 2.305 (total=1400 better)
36f1c8a	2.387	5.6	discard	emb scale sqrt(n_embd): mean 2.387 (8 runs) — init_std=0.20 renders it harmful
c2b825e	2.313	5.6	discard	betas=(0.85,0.95) only: mean 2.313 vs 2.305 baseline
1dd50c8	2.247	5.6	keep	min_lr=0.0+betas=(0.85,0.95): mean 2.297 over 16 runs, min 2.247 — NEW BEST
a3493b5	2.318	5.6	discard	betas=(0.75,0.97)+min_lr=0: mean 2.318 — beta2=0.97 alone hurts
415b293	2.299	5.6	discard	betas=(0.85,0.97)+min_lr=0: mean 2.299 — no improvement over (0.85,0.95)
f70e6d7	2.362	5.6	discard	lr=2e-2+betas=(0.85,0.95)+min_lr=0: mean 2.362 — lr=1.5e-2 still best
f3cba49	2.331	5.6	discard	n_head=8: mean 2.331 — n_head=4 stays best
7ba0510	2.309	5.6	discard	MLP 3x ratio: mean 2.309 — 4x slightly better
5141177	2.300	5.6	discard	min_lr=0+betas=(0.75,0.95): mean 2.300 — confirms betas=(0.85,0.95) adds marginal benefit
aa5920c	2.381	5.6	discard	warmup=100: mean 2.381 — warmup=50 is better
449b5ed	2.423	5.6	discard	proj_std=0.10: mean 2.423 — 0.05 stays optimal
694dc49	2.386	5.6	discard	proj_std=0.02: mean 2.386 — 0.05 is sweet spot
5a30aa1	2.469	5.6	discard	seq_len=128: ~600 steps too few, mean 2.469
e4a99e1	2.501	5.6	discard	seq_len=32: worse context, mean 2.501
94c8a02	2.407	5.6	discard	wd=0.1: mean 2.407 — wd=0.2 still best
df90041	2.450	5.6	discard	std=0.18: mean 2.450 — 0.20 is sweet spot
0269814	2.457	5.6	discard	std=0.22: mean 2.457 — 0.20 is sweet spot
4d1161c	2.340	5.6	note	total=800 throttled (700-930 steps): 2.340 mean — schedule adaptation helps under throttle
7697983	2.456	5.5	discard	n_embd=96: mean 2.456 — 128 still best
e723275	2.900	5.6	discard	parallel attn+mlp (PaLM): mean 2.900 — catastrophic failure
527fa5f	2.483	5.6	discard	MLP 2x ratio: mean 2.483 — 4x needed
9c25dff	2.351	5.6	note	total=1000 throttled: mean 2.351 — better than total=1400 under throttle
4e25b29	2.445	5.6	discard	RoPE: mean 2.445 throttled, inconclusive (hardware thermal)
0e25338	2.562	5.6	discard	batch=32: mean 2.562 — batch=64 stays best
bdbdebf	2.337	5.5	discard	batch=128+time-based cosine: mean 2.337 throttled (worse than step-based 2.297 unthrottled)
8c18f39	2.366	5.6	discard	time-based cosine+batch=64: mean 2.366 throttled
6016870	2.244	5.5	keep	batch=128+lr=2e-2+time-based cosine: mean 2.303 over 16 runs throttled — robust!
993d958	2.325	5.5	discard	lr=2.5e-2 batch=128: mean 2.325 — 2e-2 better
097c19d	2.322	5.5	discard	lr=1.75e-2 batch=128: mean 2.322 — 2e-2 still best
a0e0100	2.317	5.5	discard	betas=(0.9,0.95)+batch=128+lr=2e-2: mean 2.317 — 0.85 better
7ea575d	2.255	5.5	keep	betas=(0.80,0.95)+batch=128+lr=2e-2+time-cosine: mean 2.289 16-runs — NEW BEST
dc1fb19	2.308	5.5	discard	betas=(0.75,0.95)+batch=128: mean 2.308 — 0.80 better
b1a543e	2.311	5.5	discard	betas=(0.82,0.95)+batch=128: mean 2.311 — 0.80 is sweet spot
c99ca33	2.317	5.5	discard	beta2=0.97: mean 2.317 — 0.95 better
c0df303	2.294	5.5	discard	beta2=0.99: mean 2.294 (16 runs) — 0.95 still slightly better
8db855e	2.297	5.5	discard	wd=0.1+batch=128: mean 2.297 — 0.2 better
24e61dc	2.293	5.5	discard	wd=0.3+batch=128: mean 2.293 — within noise of 0.2
a541c65	2.382	5.5	discard	wd=0.5: mean 2.382 — too high
3e854fa	2.314	5.5	discard	warmup_frac=0.02: mean 2.314
dcfe6c7	2.307	5.5	discard	warmup_frac=0.10: mean 2.307
7ea575d	2.255	5.5	keep	batch=128+lr=2e-2+betas=(0.80,0.95)+time-cosine: mean 2.290 over 24 runs under throttle — prev BEST
063853b	2.292	5.5	discard	std=0.24: mean 2.292 — similar to 0.20 but 0.20 is baseline
f548884	2.314	5.5	discard	std=0.28: mean 2.314 — 0.20 stays best
e05ab62	2.307	5.5	discard	SwiGLU 8/3 hidden ratio: mean 2.307 — 4x stays best
b6d6679	2.364	5.8	discard	n_layer=2+n_embd=96+lr=1.5e-2+warmup=35% (per 0x249f3d6c): mean 2.364 over 8 runs — much worse (fewer steps per step)
a2fb7e8	2.309	5.8	discard	n_embd=144: mean 2.309 over 8 runs — 128 still best (fewer steps with larger model)
2c4320d	2.247	5.5	keep	epoch-style dataloader: mean 2.272 over 16 runs
e9a5595	2.292	5.5	discard	epoch-style stride=32 (overlapping): mean 2.292 — worse than stride=64 (2.272), non-overlapping optimal
e0a0bdb	2.289	5.5	discard	warmup_frac=0.08 + epoch-style: mean 2.289 — 0.05 still best
2a0d451	2.360	5.5	discard	label_smoothing=0.05: mean ~2.360 (2 runs 2.340+2.381) — model underfits, smoothing hurts
35ddf86	2.294	5.5	discard	selective wd (decay=2D,skip=emb): mean 2.294 — uniform wd=0.2 for all params still better
bqf6dn0	2.302	5.5	discard	beta1=0.78: mean 2.302 — 0.80 is true sweet spot
bb42dvk	2.299	5.5	discard	n_embd=112: mean 2.299 — 128 still optimal (capacity > steps tradeoff)
bip2403	2.292	5.5	discard	clip_grad=2.0: mean 2.292 — 1.0 still best
b3th1d7	2.358	5.5	discard	n_head=2 (64-dim heads): mean ~2.358 (3 runs) — n_head=4 definitively better
b6mqitf	2.337	5.5	discard	c_attn bias=True (QKV bias): mean ~2.337 (6 runs) — no-bias stays best
bvdskn6	2.310	5.5	discard	min_lr_frac=0.05: mean 2.310 — min_lr=0.0 confirmed best
ba24rbm	2.432	5.5	discard	wpe_std=0.05 (small pos emb init): mean ~2.432 (2 runs) — catastrophic; wpe needs std=0.20
b37cwcv	2.342	5.5	discard	seq_len=80: mean ~2.342 (3 runs) — fewer steps, 64 stays best
b48thl8	2.316	5.5	discard	warmup_frac=0.03: mean 2.316 (6 runs) — 0.05 confirmed best
bb1x20j	2.308	5.5	discard	lr=2.2e-2 + epoch-style: mean 2.308 (6 runs) — 2e-2 optimal
b09is0e	2.287	5.5	discard	batch=192 + epoch-style: mean 2.287 (8 runs) — 128 still best (high variance)
bvqy264	2.243	5.5	keep	final ln_f (LayerNorm) + epoch-style: mean 2.265 over 16 runs — prev BEST
bn9qdgm	2.237	5.5	keep	final RMSNorm + epoch-style: mean 2.272 over 16 runs — was best before tensor precompute
bvdgdh0	2.198	5.5	BEST	pre-built tensor epoch loader: mean 2.263 over 16 runs (2.247 cool, 2.280 throttled) — ROBUST NEW BEST; 851-956 steps cool
b63wzw4	2.288	5.5	discard	pre-norm RMSNorm in blocks + final RMSNorm: mean 2.288 — extra overhead hurts, final-only best
bczipom	2.296	5.5	discard	beta1=0.82 + RMSNorm: mean 2.296 — 0.80 stays optimal
bqxi3ab	2.284	5.5	discard	init_std=0.22 + RMSNorm: mean 2.284 — 0.20 stays best
b33vep9	2.278	5.5	discard	wd=0.15 + RMSNorm: mean 2.278 — 0.2 still optimal
bq85rmt	2.290	5.5	discard	proj_std=0.04 + RMSNorm: mean 2.290 — 0.05 stays optimal
bficzvi	2.276	5.5	discard	batch=160 + RMSNorm+epoch: mean 2.276 — 128 stays optimal
b2kc96f	2.271	5.5	discard	beta2=0.93 + RMSNorm+epoch: mean 2.271 — 0.95 stays optimal
note	2.315	6.0	discard	bfloat16 autocast on MPS: slower + worse (2.315, 416 steps) — overhead hurts
bf2ivq	2.402	5.5	discard	QK norm (RMSNorm on Q and K): catastrophic ~2.400 with 309-406 steps — overhead is huge
b1n9ioa	2.304	5.5	discard	eps=1e-7: mean 2.304 (heavy throttle); unthrottled runs 2.264-2.272, inconclusive; keep default 1e-8
b3cb131	2.301	5.5	discard	proj_std=0.06: mean 2.301 — 0.05 stays optimal
bn6um3p	2.328	5.5	discard	quadratic LR decay: mean 2.328 (4 runs) — cosine decay is better
bknmfoh	2.286	5.5	discard	lr=1.8e-2 + pre-built loader: mean 2.286 — 2e-2 still optimal even with more steps
bffrirv	2.284	5.5	discard	warmup=0.08 + pre-built loader: mean 2.284 — 0.05 stays best
ba8pb8l	2.301	5.5	discard	n_embd=144 + pre-built loader: mean 2.301 (incl 2.475 outlier) — 128 stays optimal
075d3ae	2.439	5.8	discard	n_layer=2+n_embd=96+lr=1.5e-2 re-test w/pre-built loader: 2.306-2.439, 316-444 steps — still compute-limited; 1-layer definitively better
fdc5555	2.277	5.5	discard	beta1=0.79: mean 2.277 over 16 runs — 0.80 still optimal
c3af8d3	2.294	5.5	discard	beta2=0.97 + pre-built loader: mean 2.294 (8 runs) — 0.95 stays best
3697121	2.332	5.5	discard	lr=2.1e-2: mean 2.332 (8 runs, throttled) — 2e-2 stays optimal
1e96384	2.317	5.5	discard	wd=0.25: mean 2.317 (8 runs) — 0.2 still optimal
2676d38	2.346	5.5	discard	lm_head bias=True: mean 2.346 (8 runs) — bias=False stays best
5563883	2.298	5.5	discard	warmup_frac=0.04: mean 2.298 (8 runs) — 0.05 confirmed best
0d46bdb	2.583	5.5	discard	2-cycle cosine LR: mean ~2.58 (8 runs) — catastrophic; ends on high LR in cycle 2
901a895	2.363	5.5	discard	n_head=1 (head_dim=128): mean 2.363 (8 runs) — n_head=4 definitively better
5bf9290	2.279	5.5	note	on-device pre-loaded tensors: mean 2.279 (16 runs, throttled) — inconclusive vs 2.263 baseline (also throttled)
92086bc	2.292	5.5	discard	grad_clip=0.5: mean 2.292 (8 runs) — 1.0 stays best
cd1aec2	2.297	5.5	discard	learned wpe_scale: mean 2.297 (8 runs) — fixed scale=1.0 stays best
b0dea93	2.305	5.5	discard	torch.compile(aot_eager): mean 2.305 (16 runs) — overhead hurts; no speedup vs eager on MPS
37bbbc3	2.278	5.5	discard	SwiGLU 3.5x hidden (448): mean 2.278 (16 runs, throttled, 555 steps avg) — 4x stays best under cool conditions
note	2.342	5.5	discard	SiLU-only 6x MLP (no up branch): 2.342 single run — gating critical; not committed
92bc279	2.295	5.5	discard	gate/up init std=0.10: mean 2.295 (16 runs) — std=0.20 stays best for all
9b22943	2.277	5.5	discard	value residual in attn (v += x): mean 2.277 (16 runs, throttled) — no clear improvement
d1e9f28	2.299	5.5	discard	seq_len=48: mean 2.299 (8 runs, 586 steps) — more steps but context loss worse; seq=64 best
note	2.407	5.5	discard	tied QK (shared Q=K weights): 2.407 single run — symmetric attention is bad; not committed
398f9cc	2.295	5.5	discard	batch=192+lr=2.2e-2 w/on-device loader: mean 2.295 (8 runs, 379 steps) — batch=128 still best
0ea50d7	2.300	5.5	discard	sinusoidal wpe init: mean 2.300 (8 runs) — random normal std=0.20 still best
92f49dd	2.390	5.5	discard	LayerScale γ=0.1: mean ~2.39 (8 runs, catastrophic) — init=0.1 too small; diverges
note	3.291	5.5	discard	no wpe: 3.291 single run — position embeddings critical; not committed
4ce4c67	2.358	5.5	discard	lr=1.9e-2: mean 2.358 (8 runs, severe throttle 301-538 steps) — 2e-2 stays optimal
e9e1301	2.290	5.5	discard	local attn K=32: mean 2.290 (8 runs) — custom attn_mask SLOWER than is_causal=True on MPS; full causal best
note	2.443	5.5	discard	MQA (4Q+1K+1V heads): 2.443 single run — 1 KV head too limiting; not committed
a4f9dc3	2.295	5.5	discard	proj_std=0.07: mean 2.295 (16 runs, throttled) — 0.08 slightly better
560d685	2.294	5.5	discard	proj_std=0.08: mean 2.294 (16 runs, throttled) — 0.09 better
e487fc5	2.274	5.5	keep	proj_std=0.09: mean 2.274 vs baseline 2.304 (16 runs, throttled) — +0.030 improvement; strong signal
1ba7505	2.281	5.5	discard	proj_std=0.10: mean 2.281 (16 runs, throttled) — 0.09 slightly better; 0.09 is sweet spot
56767e1	2.284	5.5	discard	proj_std=0.12: mean 2.284 (8 runs) — confirms 0.09 is sweet spot
710461c	2.296	5.5	discard	main_std=0.18+proj=0.09: mean 2.296 — 0.20+0.09 better (0.09 works best with main=0.20)
3305b48	2.287	5.5	discard	lr=1.8e-2+proj=0.09: mean 2.287 — 2e-2 still optimal LR even with larger proj_std
ef5b226	2.286	5.5	discard	beta1=0.85+proj=0.09: mean 2.286 — 0.80 still optimal beta1 with new init
0c15f06	2.274	5.5	BEST	proj_std=0.09 confirmed: mean 2.274 over 16 runs (throttled, 502 steps) — +0.030 vs same-session baseline 2.304; beats bvdgdh0 extrapolated
51aa8e1	2.273	5.5	discard	wd=0.15+proj=0.09: mean 2.273 (16 runs) — within noise of wd=0.2 (2.274)
596ff42	2.287	5.5	discard	wd=0.10+proj=0.09: mean 2.287 — wd=0.2 confirmed best even with proj_std=0.09
2a1e1e2	2.301	5.5	discard	c_attn std=0.15: mean 2.301 — main std=0.20 best for c_attn too
9b30e87	2.269	5.5	keep	clip=0.8+proj=0.09: mean 2.269 vs baseline 2.274 (16 runs throttled) — +0.005 more improvement!
45c0d65	2.274	5.5	discard	clip=0.7: mean 2.274 (8 runs) — 0.8 is sweet spot
192cfd6	2.298	5.5	discard	clip=0.9: mean 2.298 (8 runs) — 0.8 confirmed sweet spot
5eeacb1	2.282	5.5	discard	main_std=0.22+clip=0.8+proj=0.09: mean 2.282 (16 runs, 2.479 outlier) — high variance; 0.20 stays
ffa28a1	2.299	5.5	discard	warmup_frac=0.04: mean 2.299 (8 runs) — 0.05 still best
ffa28a1	2.283	5.5	discard	warmup_frac=0.06: mean 2.283 (first 8 lucky), 2.310 (next 8), combined 2.295 — 0.05 stays
ffa28a1	2.323	5.5	discard	weight_decay=0.3: mean 2.323 (8 runs) — 0.2 confirmed best
ffa28a1	2.306	5.5	discard	weight_decay=0.25: mean 2.306 (8 runs) — 0.2 confirmed best
ffa28a1	2.325	5.5	discard	lr=2.2e-2: mean 2.325 (8 runs) — 2e-2 confirmed optimal
ffa28a1	2.315	5.5	discard	lr=1.9e-2: mean 2.315 (8 runs) — 2e-2 confirmed optimal
ffa28a1	2.314	5.5	discard	SwiGLU 3x hidden: mean 2.314 (8 runs) — 4x hidden confirmed best
ffa28a1	2.310	5.5	discard	n_embd=144: mean 2.310 (8 runs) — 128 optimal; larger model is slower
ffa28a1	2.307	5.5	discard	batch_size=256: mean 2.307 (8 runs) — 128 confirmed best
ffa28a1	2.304	5.5	discard	n_head=8 (head_dim=16): mean 2.304 (8 runs) — 4 heads best
ffa28a1	2.315	5.5	discard	n_head=2 (head_dim=64): mean 2.315 (8 runs) — 4 heads best
ffa28a1	2.326	5.5	discard	label_smoothing=0.05: mean 2.326 (8 runs) — no smoothing best
ffa28a1	2.328	5.5	discard	dropout=0.05: mean 2.328 (8 runs) — 0.0 best
ffa28a1	2.282	5.5	discard	linear LR decay: mean 2.282 (8 runs) — cosine better
ffa28a1	2.281	5.5	discard	beta1=0.75: mean 2.281 (8 runs) — 0.80 baseline still best
ffa28a1	2.330	5.5	discard	RoPE (no wpe): mean 2.330 (8 runs) — absolute wpe better with current config
ffa28a1	2.265	5.5	BEST	beta1=0.82: mean 2.265 over 24 seeds vs 0.80 baseline 2.278 — new best!
2fb31f7	2.266	5.5	discard	beta1=0.83: mean 2.266 (8 runs) — same as 0.82, 0.82 stays
2fb31f7	2.269	5.5	discard	beta1=0.81: mean 2.269 (8 runs) — same as 0.82, 0.82 stays
2fb31f7	2.267	5.5	discard	beta2=0.97 + beta1=0.82: mean 2.267 (8 runs) — 0.95 stays best
2fb31f7	2.291	5.5	discard	beta2=0.93 + beta1=0.82: mean 2.291 (8 runs) — 0.95 confirmed
2fb31f7	2.272	5.5	discard	main_std=0.18 + beta1=0.82: mean 2.272 (16 runs) — 0.20 stays
2fb31f7	2.264	5.5	discard	clip=0.7 + beta1=0.82: mean 2.264 (16 runs) — same as clip=0.8, 0.8 stays
2fb31f7	2.274	5.5	discard	clip=0.6 + beta1=0.82: mean 2.274 (8 runs) — 0.8 still better
2fb31f7	2.281	5.5	discard	lm_head bias=True + beta1=0.82: mean 2.281 (8 runs) — no-bias best
2fb31f7	2.271	5.5	discard	proj_std=0.10 + beta1=0.82: mean 2.271 (8 runs) — 0.09 best
2fb31f7	2.255	5.5	BEST	lr=2.5e-2 + beta1=0.82: mean 2.255 (24 seeds) vs 2.265 baseline — new best!
0caa1cd	2.263	5.5	discard	lr=3.0e-2: mean 2.263 (8 runs) — 2.5e-2 stays best
0caa1cd	2.257	5.5	discard	lr=2.8e-2: mean 2.257 (16 runs) — similar to 2.5e-2, 2.5e-2 stays
0caa1cd	2.272	5.5	discard	lr=2.3e-2: mean 2.272 (8 runs) — 2.5e-2 confirmed sweet spot
0caa1cd	2.249	5.5	note	wd=0.15 (early reads): mean 2.249 over 24 seeds but cooler system; paired test shows 2.249 vs wd=0.2=2.240 — thermal artifact
0caa1cd	2.240	5.5	discard	wd=0.2 paired baseline: mean 2.240 (8 runs same session) — wd=0.2 confirmed best with paired test
0caa1cd	2.277	5.5	discard	wd=0.1: mean 2.277 (4 runs) — too low, 0.2 best
0caa1cd	2.319	5.5	discard	warmup_frac=0.03 with lr=2.5e-2: mean 2.319 — higher LR needs warmup; 0.05 stays
0caa1cd	2.299	5.5	discard	warmup_frac=0.07 with lr=2.5e-2: mean 2.299 — 0.05 confirmed optimal
0caa1cd	2.316	5.5	discard	clip=1.0 with lr=2.5e-2: mean 2.316 — higher LR requires tighter clip; 0.8 best
0caa1cd	2.292	5.5	discard	proj_std=0.08 with lr=2.5e-2: mean 2.292 — 0.09 stays best
0caa1cd	2.289	5.5	discard	proj_std=0.11 with lr=2.5e-2: mean 2.289 — 0.09 confirmed sweet spot
f1454cd	2.272	5.5	discard	n_embd=120: mean 2.272 (8 runs) — 128 optimal
f1454cd	2.272	5.5	discard	wpe_std=0.02 separate: mean 2.355 — wpe needs std=0.20 same as wte
f1454cd	2.264	5.5	discard	separate emb LR 0.5x: mean 2.286 — uniform LR best
f1454cd	2.272	5.5	discard	separate emb LR 2x: mean 2.272 — uniform LR confirmed best
f1454cd	2.289	5.5	discard	c_attn_std=0.15 separate init: mean 2.289 — main std=0.20 also best for c_attn
f1454cd	2.279	5.5	discard	zero-init c_proj (residual stability): mean 2.264 (12 runs, high var) — normal 0.09 better
f1454cd	2.289	5.5	discard	ln_f.weight=1.0 (skip custom init for norm): mean 2.272 (16 runs) — norm std=0.20 actually helps
f1454cd	2.316	5.5	discard	seq_len=128: mean 2.505 (8 runs) — too few steps; seq=64 confirmed best
f1454cd	2.282	5.5	discard	linear LR decay with new config: mean 2.282 (8 runs) — cosine confirmed best
6ea6072	2.259	5.5	discard	clip=0.5: mean 2.259 (16 runs) — 0.8 confirmed (0.5 within noise but higher)
6ea6072	2.257	5.5	discard	AdamW eps=1e-6: mean 2.257 (16 runs) — thermal artifact; default eps best
6ea6072	2.276	5.5	discard	main_std=0.25: mean 2.276 (8 runs) — 0.20 confirmed
6ea6072	2.276	5.5	discard	attn scale=1.2x: mean 2.260 (20 runs) — thermal artifact; default scale best
6ea6072	2.275	5.5	discard	attn scale=0.8x: mean 2.275 (8 runs) — default scale confirmed
6ea6072	2.268	5.5	discard	RMSNorm eps=1e-6: mean 2.268 (24 runs) — thermal artifact; default eps best
c048667	2.277	5.5	discard	down_std=0.12 vs c_proj=0.09: mean 2.266 (8 runs) — within noise; uniform proj=0.09 best
c048667	2.266	5.5	discard	down_std=0.07 vs c_proj=0.09: mean 2.266 (16 runs) — within noise; uniform proj=0.09 best
c048667	2.268	5.5	discard	2x coverage (shifted windows): mean 2.268 (8 runs) — 1x epoch best
c048667	2.303	5.5	discard	no weight tying: mean 2.303 (8 runs) — weight tying confirmed best
c048667	2.331	5.5	discard	batch_size=160: mean 2.331 (8 runs) — 128 confirmed best
c048667	2.275	5.5	note	n_layer=2 n_embd=80: unstable with lr=2.5e-2 (multiple NaN/3.6+ runs); 1-layer definitively best
c048667	2.277	5.5	note	5x SwiGLU hidden: mean 2.277 (8 runs) — 4x stays best
c048667	2.275	5.5	note	final 8-run measurement: mean 2.275 (throttled, 489-553 steps)
bf35dfb	2.301	5.5	discard	LR overshoot (1.5x peak): mean 2.301 (8 runs) — standard cosine confirmed
bf35dfb	2.430	5.5	discard	ALiBi positional bias (no wpe): 2.431 single run — absolute wpe+SDPA is_causal faster
bf35dfb	2.281	5.5	discard	epoch stride=48 (partial overlap): mean 2.281 — stride=64 confirmed best
bf35dfb	2.282	5.5	discard	residual scale=0.9: mean 2.281 (4 runs) — standard residual better
e757059	2.318	5.5	discard	ReGLU (F.relu) vs SwiGLU (F.silu): mean 2.318 (8 runs) — clearly worse by +0.063 BPB; SwiGLU confirmed best
5fbf6a1	2.287	5.5	discard	GeGLU (F.gelu) vs SwiGLU: GeGLU 2.285 vs SwiGLU 2.263 paired (4 runs each, matched thermal) — SwiGLU confirmed best by +0.022
5fbf6a1	2.319	5.5	discard	MishGLU (F.mish) vs SwiGLU: mean 2.319 (8 runs) — clearly worse, Mish also slower on MPS; SwiGLU confirmed best
5fbf6a1	2.300	5.5	discard	Sq-ReGLU (relu^2 gate): mean 2.300 (8 runs) — worse than SwiGLU 2.255; SwiGLU confirmed
9e47d71	4.531	5.5	discard	RAdam: catastrophic 4.53 bpb — RAdam lacks decoupled WD; wd=0.2 L2 penalty destroys training
9e47d71	2.500	5.5	discard	sqrt LR decay (1/sqrt(1+99t)→0.1 at end): mean 2.500 (8 runs) — LR too high at end; cosine confirmed
9e47d71	2.285	5.5	discard	wte_std=0.15 (separate from wpe=0.20): mean 2.285 (8 runs) — uniform std=0.20 for all weights best
9e47d71	2.259	5.5	discard	cosine warmup (vs linear): mean 2.257 vs baseline 2.259 paired (8 each) — identical; linear stays
9e47d71	2.259	5.5	discard	beta1=0.84 (vs 0.82): 16-run mean 2.269 vs 2.274 but thermal-confounded; gap closes in 2nd batch — 0.82 stays
5fa451e	2.250	5.5	BEST	MLP 6x hidden (vs 4x): mean 2.250 over 16 runs vs 4x mean 2.268 (16 paired) — 0.018 improvement; 6x wins despite fewer steps
